{
  "schema_version": "0.1",
  "generated_at": "2026-06-02T00:30:35.672226Z",
  "source_artifacts": {
    "local_semantic_candidates": "/Users/kangmin/Documents/excel-workbook-editing/review-packages/workbook-understanding/mbp-2026-02-local-semantic-candidates.json",
    "domain_source_model": "/Users/kangmin/Documents/excel-workbook-editing/review-packages/workbook-understanding/mbp-2026-02-domain-source-model.json",
    "data_view_projection": "/Users/kangmin/Documents/excel-workbook-editing/review-packages/workbook-understanding/mbp-2026-02-data-view-projection.json"
  },
  "method": {
    "name": "deterministic_shared_ontology_alignment_review",
    "authority": "review_only_no_shared_promotion",
    "decision_policy": "Evaluate boundary-scoped local semantic candidates against shared ontology promotion prerequisites. In this sample, do not emit shared ontology updates unless local boundary, local source evidence, repeated workbook-family evidence, conflict checks, formula-result authority, and human approval are all satisfied."
  },
  "alignment_context": {
    "local_boundary_id": "local_boundary:workbook_sample:3392b1854fec",
    "local_boundary_status": "review_required",
    "local_boundary_scope": "current_workbook_only_until_boundary_confirmed",
    "local_boundary_confirmed": false,
    "local_domain_source_count": 0,
    "general_domain_source_count": 8,
    "data_view_projection_count": 44,
    "shared_ontology_target_status": "not_provided",
    "alignment_authority": "human_review_packet_only",
    "shared_promotion_preconditions": [
      {
        "name": "local_boundary_confirmed",
        "status": "blocked",
        "description": "A declared organization/project/team/tenant/workbook-family boundary is confirmed.",
        "missing_action": "Confirm the local boundary that makes local terminology valid."
      },
      {
        "name": "local_domain_sources_available",
        "status": "blocked",
        "description": "Local policy, vocabulary, or owner-approved source evidence is available.",
        "missing_action": "Provide local policy/vocabulary evidence before treating local terms as reusable."
      },
      {
        "name": "repeated_workbook_family_evidence_available",
        "status": "blocked",
        "description": "The same candidate meaning appears across workbook pairs or workbook families.",
        "missing_action": "Collect repeated evidence from source/output workbook pairs or adjacent periods."
      },
      {
        "name": "shared_ontology_target_available",
        "status": "blocked",
        "description": "An existing shared ontology target is available for duplicate/conflict checks.",
        "missing_action": "Provide a shared ontology target or mark this review as candidate-only."
      },
      {
        "name": "human_approval_recorded",
        "status": "blocked",
        "description": "A domain owner has approved the promotion scope and label.",
        "missing_action": "Record human approval after reviewing blockers and conflicts."
      }
    ]
  },
  "alignment_items": [
    {
      "id": "alignment_item:cde999f0d9d7",
      "type": "shared_ontology_alignment_item",
      "candidate_id": "local_semantic_candidate:accepted_context:semantic_concept_cumulative_revenue_surface_누적_9c6b596ecf:20780e9b5a64",
      "label": "누적 집계 및 이월 표면",
      "candidate_kind": "cumulative_rollforward_surface",
      "source_kind": "accepted_semantic_context",
      "alignment_status": "blocked_basis_definition_pending",
      "promotion_decision": "not_promoted",
      "proposed_shared_concept_id": null,
      "existing_shared_concept_refs": [],
      "blockers": [
        "local_domain_boundary_not_confirmed",
        "no_local_domain_sources_available",
        "formula_result_validation_pending",
        "gaap_ifrs_basis_mapping_required",
        "repeated_workbook_family_evidence_missing",
        "shared_ontology_target_not_provided",
        "human_approval_required"
      ],
      "conflict_risks": [
        "dual_basis_revenue_interpretation_risk",
        "local_vocabulary_absent_risk",
        "formula_result_not_recalculated_risk"
      ],
      "required_evidence": [
        "confirmed_organization_or_project_boundary",
        "local_policy_or_vocabulary_source",
        "workbook_family_or_pair_repetition_evidence",
        "shared_ontology_duplicate_and_conflict_check",
        "human_approval_record",
        "k_gaap_vs_k_ifrs_output_definition",
        "official_ifrs_revenue_aggregation_definition",
        "excel_engine_recalculation_sample"
      ],
      "human_review_questions": [
        "이 후보의 의미가 현재 워크북에만 유효한가, 아니면 반복되는 워크북 family에서도 동일하게 쓰이는가?",
        "이 후보명을 승인할 local policy, glossary, 또는 업무 담당자 근거가 있는가?",
        "이 표면은 K-GAAP 기준 월 매출 출력인가, K-IFRS 수익인식 계산 보조 표면인가, 또는 둘의 bridge인가?",
        "공유 후보 판단 전에 Excel 엔진으로 대표 formula 결과를 재계산했는가?"
      ],
      "basis_review": {
        "required": true,
        "detected_terms": [
          "수익인식",
          "해당 매출"
        ],
        "reason": "K-GAAP-labeled output and K-IFRS-relevant revenue recognition surfaces must be separated before shared promotion."
      },
      "data_view_refs": {
        "data_view_ids": [
          "data_view:pipeline_누적_cell_region_1"
        ],
        "projection_ids": [
          "projection:data_view:pipeline_누적_cell_region_1"
        ],
        "sheets": [
          "누적"
        ],
        "ranges": [
          "A1:EB20"
        ],
        "projection_kinds": [
          "formula_summary_projection"
        ],
        "roles": [
          "summary"
        ],
        "sampled_projection_count": 1,
        "formula_cell_count": 15
      },
      "observed_terms": [
        "누계",
        "누적",
        "누적 집계",
        "위탁판매",
        "이월",
        "DATA",
        "해당 일수",
        "해당 매출",
        "아임포트주문번호",
        "결제년도",
        "결제월",
        "매출일자",
        "강의결제액",
        "교육과정명",
        "부서",
        "브랜드",
        "코스 개강일",
        "코스 개강일2",
        "코스 종강일",
        "수익인식방법",
        "코스 일수",
        "일수당 결제금액",
        "무의미",
        "imp_131659167335",
        "2024-01-01",
        "전강좌ALL패키지",
        "퍼블리싱",
        "유하다요",
        "imp_509870577519",
        "imp_829452422591",
        "imp_370127871967",
        "imp_092007133817",
        "imp_956350070524",
        "imp_378570026611",
        "imp_826962720067"
      ],
      "evidence_refs": [
        "semantic_concept:cumulative_revenue_surface_누적:9c6b596ecf",
        "data_view:pipeline_누적_cell_region_1",
        "gate_target_누적_cell_region_1_formula_region_coherence",
        "gate_target_누적_cell_region_1_formula_summary_visual_alignment",
        "group_누적_row_band_1_1",
        "group_누적_row_band_1_2",
        "pipeline_누적_cell_region_1",
        "result_gate_target_누적_cell_region_1_formula_region_coherence",
        "result_gate_target_누적_cell_region_1_formula_summary_visual_alignment",
        "role_validation_pipeline_누적_cell_region_1"
      ],
      "source_artifact_refs": [
        "llm_proposals",
        "llm_proposal_validation",
        "document_ontology_mapping",
        "data_view_projection",
        "domain_source_model",
        "validated_document_graph",
        "local_semantic_candidates"
      ]
    },
    {
      "id": "alignment_item:53371d43a7d5",
      "type": "shared_ontology_alignment_item",
      "candidate_id": "local_semantic_candidate:accepted_context:semantic_concept_instructor_fee_matching_schedule_수익인식60일_강사료_a9e099e2ba:88dd509ee69c",
      "label": "강사료 기간 대응 스케줄",
      "candidate_kind": "expense_matching_schedule",
      "source_kind": "accepted_semantic_context",
      "alignment_status": "blocked_basis_definition_pending",
      "promotion_decision": "not_promoted",
      "proposed_shared_concept_id": null,
      "existing_shared_concept_refs": [],
      "blockers": [
        "local_domain_boundary_not_confirmed",
        "no_local_domain_sources_available",
        "formula_result_validation_pending",
        "gaap_ifrs_basis_mapping_required",
        "repeated_workbook_family_evidence_missing",
        "shared_ontology_target_not_provided",
        "human_approval_required"
      ],
      "conflict_risks": [
        "dual_basis_revenue_interpretation_risk",
        "local_vocabulary_absent_risk",
        "formula_result_not_recalculated_risk"
      ],
      "required_evidence": [
        "confirmed_organization_or_project_boundary",
        "local_policy_or_vocabulary_source",
        "workbook_family_or_pair_repetition_evidence",
        "shared_ontology_duplicate_and_conflict_check",
        "human_approval_record",
        "k_gaap_vs_k_ifrs_output_definition",
        "official_ifrs_revenue_aggregation_definition",
        "excel_engine_recalculation_sample"
      ],
      "human_review_questions": [
        "이 후보의 의미가 현재 워크북에만 유효한가, 아니면 반복되는 워크북 family에서도 동일하게 쓰이는가?",
        "이 후보명을 승인할 local policy, glossary, 또는 업무 담당자 근거가 있는가?",
        "이 표면은 K-GAAP 기준 월 매출 출력인가, K-IFRS 수익인식 계산 보조 표면인가, 또는 둘의 bridge인가?",
        "공유 후보 판단 전에 Excel 엔진으로 대표 formula 결과를 재계산했는가?"
      ],
      "basis_review": {
        "required": true,
        "detected_terms": [
          "수익인식",
          "환불부채",
          "환급부채",
          "해당 매출"
        ],
        "reason": "K-GAAP-labeled output and K-IFRS-relevant revenue recognition surfaces must be separated before shared promotion."
      },
      "data_view_refs": {
        "data_view_ids": [
          "data_view:pipeline_수익인식60일_강사료_cell_region_1",
          "data_view:pipeline_수익인식60일_강사료_cell_region_2",
          "data_view:pipeline_수익인식60일_강사료_pivot_피벗_테이블2"
        ],
        "projection_ids": [
          "projection:data_view:pipeline_수익인식60일_강사료_cell_region_1",
          "projection:data_view:pipeline_수익인식60일_강사료_cell_region_2",
          "projection:data_view:pipeline_수익인식60일_강사료_pivot_피벗_테이블2"
        ],
        "sheets": [
          "수익인식60일_강사료"
        ],
        "ranges": [
          "A1:X20",